{
  "version": 1,
  "contract": "alice-publisher-v1",
  "export_schema_version": 2,
  "generated_at": "2026-03-05T06:18:39.818Z",
  "artifacts": {
    "policies": "exports/policies.json",
    "policies_draft": "exports/policies-draft.json",
    "index": "exports/index.json"
  },
  "publish": {
    "source_system": null,
    "actor_id": null,
    "request_id": null,
    "pr_number": null,
    "merge_commit": "f5836b6e01d559c7ebadee758ede6e9f24c05add"
  }
}
